{"schema_version":"1.0.0","capability_id":"cap.matching","version":"1.0.0","maturity":"canonical","canonical_registry_key":"matching","family":"discovery","purpose":"Match an intent to capable candidates under context, availability, evidence and constraints.","parent":null,"inputs":["intent","candidate_set","context","constraints"],"outputs":["ranked_matches","match_evidence"],"authority":"A match is not authorization, consent or commitment.","data_classes":["intent","identity","availability","evidence"],"events":["matching.requested","matching.completed","matching.rejected"],"dependencies":["cap.discovery","cap.identity"],"providers_adapters":["ranking/provider adapters behind matching contract"],"provenance":"OMNII Common Layer seed registry; strengthened through universal matching compositions.","health":"match quality, stale candidates and provider errors are observable","replacement":"Ranking/provider implementations may change behind the same matching contract."}
