{"schema_version":"1.0.0","capability_id":"cap.identity","version":"1.0.0","maturity":"canonical","canonical_registry_key":"identity","family":"identity","purpose":"Resolve and represent governed canonical identities without creating competing identity semantics.","parent":null,"inputs":["identifier","identity_claim"],"outputs":["canonical_identity","representation"],"authority":"Identity resolution does not itself grant action authority.","data_classes":["identity","credential","provenance"],"events":["identity.observed","identity.resolved"],"dependencies":[],"providers_adapters":["DID/ENS/HNS and other identity adapters through canonical identity contract"],"provenance":"OMNII Common Layer seed registry.","health":"resolution success, ambiguity, verification and provider health are observable","replacement":"Provider or resolver can be replaced while canonical identity and provenance remain stable."}
