{
  "schema_version":"1.0.0","capability_id":"cap.discovery","version":"1.0.0","maturity":"canonical","canonical_registry_key":"discovery","family":"discovery","purpose":"Reveal discoverable entities, capabilities, resources, services and opportunities under visibility and policy rules.","parent":null,"inputs":["intent","context","visibility_policy"],"outputs":["candidates","evidence_refs"],"authority":"Discovery never grants authority; visibility and policy constraints apply.","data_classes":["identity","relationship","availability","provenance"],"events":["discovery.requested","discovery.result"],"dependencies":["cap.identity"],"providers_adapters":["provider-neutral adapter contract"],"provenance":"OMNII Common Layer seed registry; strengthened through SPOTIST and ecosystem discovery compositions.","health":"observable via discovery request/result events and provider health signals","replacement":"Replace provider implementations behind the same capability contract; preserve identifiers and provenance."
}
