{"schema_version":"1.0.0","capability_id":"cap.interoperability","version":"1.0.0","maturity":"canonical","canonical_registry_key":"interoperability","family":"integration","purpose":"Connect canonical capabilities to external protocols and providers through replaceable adapters without importing provider semantics into the common layer.","parent":null,"inputs":["capability_contract","provider_request"],"outputs":["provider_response","evidence","health"],"authority":"Adapter presence never creates business or constitutional authority.","data_classes":["integration","provenance","credentials"],"events":["adapter.invoked","adapter.failed","adapter.completed"],"dependencies":["cap.identity"],"providers_adapters":["API","MCP","A2A","webhook","import/export"],"provenance":"OMNII Common Layer seed registry and capability adapter contract.","health":"provider health, latency, error, retry and replacement signals are observable","replacement":"Any provider implementing the same canonical contract can replace another without changing product semantics."}
