{"schema_version":"1.0.0","capability_id":"cap.authority","version":"1.0.0","maturity":"canonical","canonical_registry_key":"authority","family":"governance","purpose":"Evaluate and carry delegated authority scoped by principal, issuer, capability, constraints, context and time.","parent":null,"inputs":["principal","delegation","scope","context"],"outputs":["authority_context","decision_inputs"],"authority":"Uses canonical authority/SEAL semantics and never self-issues authority.","data_classes":["identity","authority","credential","policy"],"events":["authority.presented","authority.verified","authority.expired"],"dependencies":["cap.identity"],"providers_adapters":["SEAL/authority adapters"],"provenance":"OMNII Common Layer seed registry.","health":"verification, expiry, conflict and revocation states are observable","replacement":"Authority implementations may be replaced only through compatible canonical authority contracts."}
