{"schema_version":"1.0.0","capability_id":"cap.workflow","version":"1.0.0","maturity":"canonical","canonical_registry_key":"workflow","family":"execution","purpose":"Reusable stateful orchestration of work, approvals, tasks, exceptions and outcomes.","parent":null,"inputs":["intent","authority","tasks","policy"],"outputs":["state","events","evidence","outcome"],"authority":"Workflow execution respects supplied authority and does not manufacture authority.","data_classes":["workflow","task","evidence","provenance"],"events":["workflow.started","workflow.state_changed","workflow.completed","workflow.escalated"],"dependencies":["cap.authority"],"providers_adapters":["workflow/runtime adapters behind canonical contract"],"provenance":"OMNII Common Layer seed registry and universal workflow contract.","health":"state, queue, retry, timeout and escalation signals are observable","replacement":"Workflow runtime implementations remain replaceable behind canonical workflow semantics."}
